{
  "version": "1.1.0",
  "updatedAt": "2026-08-30",
  "originalQuestionCount": 361,
  "questions": [
    {
      "id": "Q-0001",
      "title": "请完整讲清一个你主导或深度参与的 AI 项目：背景、问题、方案、结果、你的贡献",
      "tags": {
        "company": [
          "通用",
          "字节跳动",
          "腾讯",
          "阿里",
          "美团",
          "小红书",
          "百度"
        ],
        "companyStyle": [
          "简历深挖",
          "追问 ownership",
          "强调真实贡献"
        ],
        "interviewStage": [
          "一面",
          "二面",
          "业务面",
          "主管面"
        ],
        "frequency": "S",
        "companySpecific": "no"
      },
      "similarQuestions": [
        "请详细介绍一个你主导或深度参与的 AI 产品项目，你的核心贡献是什么？",
        "详细介绍一个你主导过的 AI 项目，遇到的最大挑战是什么，怎么解决的？",
        "你之前做的 AI 产品项目中，最满意的一个是什么？请简述其核心价值、用户画像和关键数据指标。",
        "再详细讲一下你的核心项目，说明项目的核心价值和行业意义。"
      ],
      "sources": [
        {
          "document": "ai_product2_integrated.xml",
          "reference": "母题 1"
        }
      ],
      "updatedAt": "2026-08-30",
      "mainCategory": "项目经历与个人贡献",
      "businessCategories": [
        "通用"
      ],
      "corePoints": [
        "项目背景、角色与贡献"
      ]
    },
    {
      "id": "Q-0002",
      "title": "你在项目里到底做了什么，哪些是你主导的，哪些不是？",
      "tags": {
        "company": [
          "通用",
          "字节跳动",
          "美团",
          "小红书",
          "腾讯"
        ],
        "companyStyle": [
          "拆 ownership",
          "辨别真假主导"
        ],
        "interviewStage": [
          "一面",
          "二面",
          "业务面"
        ],
        "frequency": "S",
        "companySpecific": "no"
      },
      "similarQuestions": [
        "你在其中承担了什么？哪些是你负责的？",
        "这个项目中哪些是你做的？",
        "你在其中承担什么角色？哪些是主导的，哪些是协助的？",
        "你在这个公司主要负责的是 PRD 文档，还是更偏产品推进与功能落地？"
      ],
      "sources": [
        {
          "document": "ai_product2_integrated.xml",
          "reference": "母题 2"
        }
      ],
      "updatedAt": "2026-08-30",
      "mainCategory": "项目经历与个人贡献",
      "businessCategories": [
        "通用"
      ],
      "corePoints": [
        "项目背景、角色与贡献"
      ]
    },
    {
      "id": "Q-0003",
      "title": "为什么当时选择这个切入点或方案，而不是别的方向？",
      "tags": {
        "company": [
          "通用",
          "字节跳动",
          "阿里",
          "腾讯"
        ],
        "companyStyle": [
          "看判断力",
          "看取舍逻辑"
        ],
        "interviewStage": [
          "一面",
          "二面",
          "主管面"
        ],
        "frequency": "A",
        "companySpecific": "no"
      },
      "similarQuestions": [
        "为什么没有选择 workflow，而是选择 agent？",
        "为什么要做 multi-agent？",
        "你之前做过某个项目，当时是怎么定义核心问题的？为什么选择这个切入点？",
        "为什么在企业知识库场景下，RAG 是更优方案，微调无法替代？"
      ],
      "sources": [
        {
          "document": "ai_product2_integrated.xml",
          "reference": "母题 3"
        }
      ],
      "updatedAt": "2026-08-30",
      "mainCategory": "项目经历与个人贡献",
      "businessCategories": [
        "通用"
      ],
      "corePoints": [
        "项目方案与关键取舍"
      ]
    },
    {
      "id": "Q-0004",
      "title": "如果重新做一遍这个项目，你会怎么优化？",
      "tags": {
        "company": [
          "通用",
          "字节跳动",
          "阿里",
          "小红书",
          "百度"
        ],
        "companyStyle": [
          "重复盘",
          "重反思",
          "看成长性"
        ],
        "interviewStage": [
          "二面",
          "三面",
          "主管面"
        ],
        "frequency": "A",
        "companySpecific": "no"
      },
      "similarQuestions": [
        "如果重新做一遍你实习的 AI 项目，你会在产品设计、落地流程上做哪些优化？",
        "这个项目后续优化方向是什么？",
        "这个项目你最满意的地方是什么？如果重新做一次，你会在哪些环节优化？",
        "你主导的项目是否做过完整复盘？核心优化点是什么，是否有落地验证？"
      ],
      "sources": [
        {
          "document": "ai_product2_integrated.xml",
          "reference": "母题 4"
        }
      ],
      "updatedAt": "2026-08-30",
      "mainCategory": "项目经历与个人贡献",
      "businessCategories": [
        "通用"
      ],
      "corePoints": [
        "项目复盘与优化"
      ]
    },
    {
      "id": "Q-0005",
      "title": "跨团队推动 AI 需求落地时，你如何协调算法、研发、业务、运营之间的冲突？",
      "tags": {
        "company": [
          "通用",
          "字节跳动",
          "阿里",
          "美团",
          "小红书"
        ],
        "companyStyle": [
          "看推进力",
          "协同力",
          "复杂组织适配"
        ],
        "interviewStage": [
          "二面",
          "三面",
          "主管面"
        ],
        "frequency": "S",
        "companySpecific": "no"
      },
      "similarQuestions": [
        "AI 项目推进过程中，多方诉求冲突你如何对齐与取舍？",
        "描述一个你协调多方资源推动项目上线的完整经历。",
        "项目推进过程中，是否出现过与研发或运营意见不一致的情况？你是如何沟通说服并推动落地的？",
        "和团队有分歧时，你是怎么说服对方的？"
      ],
      "sources": [
        {
          "document": "ai_product2_integrated.xml",
          "reference": "母题 5"
        }
      ],
      "updatedAt": "2026-08-30",
      "mainCategory": "协作推进与面试通用",
      "businessCategories": [
        "通用"
      ],
      "corePoints": [
        "跨团队协作与沟通"
      ]
    },
    {
      "id": "Q-0006",
      "title": "资源不足、排期紧、目标冲突时，你如何做优先级取舍？",
      "tags": {
        "company": [
          "通用",
          "字节跳动",
          "腾讯",
          "阿里",
          "美团"
        ],
        "companyStyle": [
          "务实",
          "强调 PM 决策力"
        ],
        "interviewStage": [
          "一面",
          "二面",
          "业务面"
        ],
        "frequency": "A",
        "companySpecific": "no"
      },
      "similarQuestions": [
        "迭代过程中遇到资源不足、排期紧张的情况，你如何做需求取舍和优先级排序？",
        "当一个产品节奏里资源不够时，你是怎么取舍的？",
        "跨团队推动 AI 需求时，算法、研发排期全部饱和，业务方又强诉求要上线，你会采用哪些方案破局？",
        "如果你提出的需求被研发判定短期技术难以实现，你会如何处理？"
      ],
      "sources": [
        {
          "document": "ai_product2_integrated.xml",
          "reference": "母题 6"
        }
      ],
      "updatedAt": "2026-08-30",
      "mainCategory": "协作推进与面试通用",
      "businessCategories": [
        "通用"
      ],
      "corePoints": [
        "优先级与资源取舍"
      ]
    },
    {
      "id": "Q-0007",
      "title": "你如何定义一个 AI 产品或功能是否成功？",
      "tags": {
        "company": [
          "通用",
          "字节跳动",
          "腾讯",
          "阿里",
          "小红书",
          "百度"
        ],
        "companyStyle": [
          "强调指标",
          "看业务 sense"
        ],
        "interviewStage": [
          "一面",
          "二面",
          "三面"
        ],
        "frequency": "S",
        "companySpecific": "no"
      },
      "similarQuestions": [
        "如何定义 AI 产品的核心 KPI 和北极星指标？和传统互联网产品指标体系有什么区别？",
        "介绍一下你在项目中的 AI 功能成功指标是如何定义的。",
        "如何量化 AI 产品功能的效果？",
        "你会重点关注哪些核心数据指标，来判断一个 AI 创作产品做得好不好？"
      ],
      "sources": [
        {
          "document": "ai_product2_integrated.xml",
          "reference": "母题 7"
        }
      ],
      "updatedAt": "2026-08-30",
      "mainCategory": "数据评测与迭代优化",
      "businessCategories": [
        "通用"
      ],
      "corePoints": [
        "指标体系与成功定义"
      ]
    },
    {
      "id": "Q-0008",
      "title": "你如何搭建评测体系，并保证评测科学、代表性足够？",
      "tags": {
        "company": [
          "字节跳动",
          "百度",
          "腾讯",
          "通用"
        ],
        "companyStyle": [
          "技术产品混合",
          "评测追问深"
        ],
        "interviewStage": [
          "一面",
          "业务面"
        ],
        "frequency": "S",
        "companySpecific": "partial"
      },
      "similarQuestions": [
        "测评集是如何构建的？",
        "你是怎么设计一个评测集的？如何保证评测集的代表性？",
        "你的评测集是怎么建立的？评测样本从哪里来？",
        "项目是怎么测试和迭代的？评测集如何构建、运行和人工标注？",
        "为什么要自己生成评测样本，而不是直接使用公开 benchmark？"
      ],
      "sources": [
        {
          "document": "ai_product2_integrated.xml",
          "reference": "母题 8"
        }
      ],
      "updatedAt": "2026-08-30",
      "mainCategory": "数据评测与迭代优化",
      "businessCategories": [
        "通用"
      ],
      "corePoints": [
        "评测体系与样本设计"
      ]
    },
    {
      "id": "Q-0009",
      "title": "你选了哪些评测指标，为什么是这些，而不是别的？",
      "tags": {
        "company": [
          "字节跳动",
          "百度",
          "腾讯",
          "通用"
        ],
        "companyStyle": [
          "追问指标定义",
          "反追问合理性"
        ],
        "interviewStage": [
          "一面",
          "二面"
        ],
        "frequency": "A",
        "companySpecific": "partial"
      },
      "similarQuestions": [
        "agent 评测选取的指标是什么？",
        "已经选取了评测指标 A，为什么还要选择指标 B？",
        "评测指标是你自己定义的，还是让大模型定义的？",
        "简历里的“指令准确率”具体是什么？怎么衡量？",
        "技术层、业务层和体验层，每一层的核心指标是什么？"
      ],
      "sources": [
        {
          "document": "ai_product2_integrated.xml",
          "reference": "母题 9"
        }
      ],
      "updatedAt": "2026-08-30",
      "mainCategory": "数据评测与迭代优化",
      "businessCategories": [
        "通用"
      ],
      "corePoints": [
        "指标体系与成功定义"
      ]
    },
    {
      "id": "Q-0010",
      "title": "离线效果不错但线上反馈一般，你如何定位问题并判断归因？",
      "tags": {
        "company": [
          "通用",
          "字节跳动",
          "腾讯",
          "阿里",
          "小红书"
        ],
        "companyStyle": [
          "重线上真实效果",
          "重归因"
        ],
        "interviewStage": [
          "二面",
          "三面",
          "主管面"
        ],
        "frequency": "A",
        "companySpecific": "no"
      },
      "similarQuestions": [
        "你的 AI 项目上线后离线评测指标表现良好，但线上用户负面反馈很多，你会从哪些维度定位 gap？",
        "用户反馈“简单问题加载慢、专业问题答不准”，你会如何定位问题并制定优化方案？",
        "如何验证 AI 回答准确率的提升来自 RAG 策略优化，而非模型本身的随机性波动？",
        "A/B 实验关注哪些指标？如何确定是你的动作带动了指标提升？"
      ],
      "sources": [
        {
          "document": "ai_product2_integrated.xml",
          "reference": "母题 10"
        }
      ],
      "updatedAt": "2026-08-30",
      "mainCategory": "数据评测与迭代优化",
      "businessCategories": [
        "通用"
      ],
      "corePoints": [
        "数据分析与问题归因"
      ]
    },
    {
      "id": "Q-0011",
      "title": "你如何收集、分类、利用 bad case，形成持续优化闭环？",
      "tags": {
        "company": [
          "通用",
          "字节跳动",
          "腾讯",
          "百度",
          "小红书"
        ],
        "companyStyle": [
          "实操导向",
          "强调闭环"
        ],
        "interviewStage": [
          "一面",
          "二面"
        ],
        "frequency": "A",